{
  "schema_version": "1.0",
  "candidate_set_id": "CSET_00150",
  "scenario_id": "SCN_0050",
  "step_index": 7,
  "physical_state_hash": "1e326e6ab3f10413a5e960e14097d830ca32b51b9e3ae6a7328bb33ab21891d8",
  "decision_context_hash": "291ed511082b248124ae87db7e0368ad93576e78a6ea5c531e7020c5a90cc6b5",
  "generator": {
    "name": "extreme_point_ems_style",
    "version": "0.1.0",
    "config_hash": "1095699fcd5bb0f022cb36b1d00573c273a97de68f21928faace4d5894eee52b",
    "top_k": 16
  },
  "coordinate_frame": "container_bottom_center",
  "length_unit": "mm",
  "raw_candidate_count": 592,
  "physical_valid_count": 5,
  "returned_count": 5,
  "candidate_order_seed": 1843342754,
  "candidates": [
    {
      "candidate_id": "cand_76e9a95d149e",
      "candidate_fingerprint": "76e9a95d149e1f7e65192ef9",
      "pick_item_id": "item_08",
      "pose": {
        "x_mm": 5.0,
        "y_mm": 0.0,
        "z_base_mm": 550.0,
        "yaw_deg": 90
      },
      "oriented_size_mm": [
        390,
        590,
        250
      ],
      "ems": {
        "ems_id": "ems_f63060c398",
        "ems_type": "supported_space"
      },
      "support": {
        "support_item_ids": [
          "item_07"
        ],
        "support_ratio": 1.0,
        "com_margin_mm": 195.0
      },
      "load": {
        "downward_load_kg": 0.0,
        "minimum_remaining_capacity_kg": 43.292
      },
      "resulting_geometry": {
        "max_height_mm": 800.0,
        "volume_utilization": 0.410819,
        "center_of_mass_offset_mm": 54.517
      },
      "geometry_score_components": {
        "compactness": 0.553664,
        "height": 0.058824,
        "stability": 1.0,
        "balance": 0.930198
      },
      "physical_valid": true,
      "physical_rejection_reasons": []
    },
    {
      "candidate_id": "cand_3f859ac8bca6",
      "candidate_fingerprint": "3f859ac8bca64bb800eabf03",
      "pick_item_id": "item_08",
      "pose": {
        "x_mm": -395.0,
        "y_mm": -5.0,
        "z_base_mm": 420.0,
        "yaw_deg": 90
      },
      "oriented_size_mm": [
        390,
        590,
        250
      ],
      "ems": {
        "ems_id": "ems_1372314543",
        "ems_type": "supported_space"
      },
      "support": {
        "support_item_ids": [
          "item_05"
        ],
        "support_ratio": 1.0,
        "com_margin_mm": 195.0
      },
      "load": {
        "downward_load_kg": 0.0,
        "minimum_remaining_capacity_kg": 43.292
      },
      "resulting_geometry": {
        "max_height_mm": 670.0,
        "volume_utilization": 0.410819,
        "center_of_mass_offset_mm": 100.266
      },
      "geometry_score_components": {
        "compactness": 0.661091,
        "height": 0.211765,
        "stability": 1.0,
        "balance": 0.871622
      },
      "physical_valid": true,
      "physical_rejection_reasons": []
    },
    {
      "candidate_id": "cand_d1bb8fa90c40",
      "candidate_fingerprint": "d1bb8fa90c400dbd82d69e54",
      "pick_item_id": "item_08",
      "pose": {
        "x_mm": -405.0,
        "y_mm": -5.0,
        "z_base_mm": 420.0,
        "yaw_deg": 90
      },
      "oriented_size_mm": [
        390,
        590,
        250
      ],
      "ems": {
        "ems_id": "ems_c29fab8cd9",
        "ems_type": "supported_space"
      },
      "support": {
        "support_item_ids": [
          "item_05"
        ],
        "support_ratio": 0.974359,
        "com_margin_mm": 185.0
      },
      "load": {
        "downward_load_kg": 0.0,
        "minimum_remaining_capacity_kg": 43.292
      },
      "resulting_geometry": {
        "max_height_mm": 670.0,
        "volume_utilization": 0.410819,
        "center_of_mass_offset_mm": 101.429
      },
      "geometry_score_components": {
        "compactness": 0.661091,
        "height": 0.211765,
        "stability": 0.974359,
        "balance": 0.870134
      },
      "physical_valid": true,
      "physical_rejection_reasons": []
    },
    {
      "candidate_id": "cand_05c537761666",
      "candidate_fingerprint": "05c537761666bbfcd4af7728",
      "pick_item_id": "item_08",
      "pose": {
        "x_mm": 395.0,
        "y_mm": -5.0,
        "z_base_mm": 500.0,
        "yaw_deg": 90
      },
      "oriented_size_mm": [
        390,
        590,
        250
      ],
      "ems": {
        "ems_id": "ems_a27f35ce48",
        "ems_type": "supported_space"
      },
      "support": {
        "support_item_ids": [
          "item_06"
        ],
        "support_ratio": 1.0,
        "com_margin_mm": 195.0
      },
      "load": {
        "downward_load_kg": 0.0,
        "minimum_remaining_capacity_kg": 43.292
      },
      "resulting_geometry": {
        "max_height_mm": 750.0,
        "volume_utilization": 0.410819,
        "center_of_mass_offset_mm": 22.05
      },
      "geometry_score_components": {
        "compactness": 0.590575,
        "height": 0.117647,
        "stability": 1.0,
        "balance": 0.971768
      },
      "physical_valid": true,
      "physical_rejection_reasons": []
    },
    {
      "candidate_id": "cand_43696b81c3ac",
      "candidate_fingerprint": "43696b81c3ac054679c0821c",
      "pick_item_id": "item_08",
      "pose": {
        "x_mm": 405.0,
        "y_mm": -5.0,
        "z_base_mm": 500.0,
        "yaw_deg": 90
      },
      "oriented_size_mm": [
        390,
        590,
        250
      ],
      "ems": {
        "ems_id": "ems_5297672c29",
        "ems_type": "supported_space"
      },
      "support": {
        "support_item_ids": [
          "item_06"
        ],
        "support_ratio": 0.974359,
        "com_margin_mm": 185.0
      },
      "load": {
        "downward_load_kg": 0.0,
        "minimum_remaining_capacity_kg": 43.292
      },
      "resulting_geometry": {
        "max_height_mm": 750.0,
        "volume_utilization": 0.410819,
        "center_of_mass_offset_mm": 21.875
      },
      "geometry_score_components": {
        "compactness": 0.585653,
        "height": 0.117647,
        "stability": 0.974359,
        "balance": 0.971992
      },
      "physical_valid": true,
      "physical_rejection_reasons": []
    }
  ]
}
