{
  "schema_version": "1.0",
  "candidate_set_id": "CSET_00264",
  "scenario_id": "SCN_0088",
  "step_index": 14,
  "physical_state_hash": "3d26e4748387d8e3771f35cba7b3a3a359b64f320045877bdbd8f7ab207ca685",
  "decision_context_hash": "8a7a3900858ac84d97bfddb9fd08f55c59d0f2170c42076cc27b60de42c557aa",
  "generator": {
    "name": "extreme_point_ems_style",
    "version": "0.1.0",
    "config_hash": "1095699fcd5bb0f022cb36b1d00573c273a97de68f21928faace4d5894eee52b",
    "top_k": 16
  },
  "coordinate_frame": "container_bottom_center",
  "length_unit": "mm",
  "raw_candidate_count": 1489,
  "physical_valid_count": 8,
  "returned_count": 8,
  "candidate_order_seed": 1609644744,
  "candidates": [
    {
      "candidate_id": "cand_71c020842cdf",
      "candidate_fingerprint": "71c020842cdfae5ccf1a9819",
      "pick_item_id": "item_15",
      "pose": {
        "x_mm": -20.0,
        "y_mm": -295.0,
        "z_base_mm": 290.0,
        "yaw_deg": 0
      },
      "oriented_size_mm": [
        380,
        250,
        360
      ],
      "ems": {
        "ems_id": "ems_5bb01d1258",
        "ems_type": "supported_space"
      },
      "support": {
        "support_item_ids": [
          "item_10"
        ],
        "support_ratio": 1.0,
        "com_margin_mm": 125.0
      },
      "load": {
        "downward_load_kg": 0.0,
        "minimum_remaining_capacity_kg": 52.19
      },
      "resulting_geometry": {
        "max_height_mm": 650.0,
        "volume_utilization": 0.402341,
        "center_of_mass_offset_mm": 14.813
      },
      "geometry_score_components": {
        "compactness": 0.575329,
        "height": 0.235294,
        "stability": 1.0,
        "balance": 0.981034
      },
      "physical_valid": true,
      "physical_rejection_reasons": []
    },
    {
      "candidate_id": "cand_a670879051ca",
      "candidate_fingerprint": "a670879051ca9ca6ea534704",
      "pick_item_id": "item_15",
      "pose": {
        "x_mm": -20.0,
        "y_mm": -375.0,
        "z_base_mm": 290.0,
        "yaw_deg": 0
      },
      "oriented_size_mm": [
        380,
        250,
        360
      ],
      "ems": {
        "ems_id": "ems_327ffb8937",
        "ems_type": "supported_space"
      },
      "support": {
        "support_item_ids": [
          "item_10"
        ],
        "support_ratio": 0.72,
        "com_margin_mm": 55.0
      },
      "load": {
        "downward_load_kg": 0.0,
        "minimum_remaining_capacity_kg": 52.19
      },
      "resulting_geometry": {
        "max_height_mm": 650.0,
        "volume_utilization": 0.402341,
        "center_of_mass_offset_mm": 10.716
      },
      "geometry_score_components": {
        "compactness": 0.535056,
        "height": 0.235294,
        "stability": 0.72,
        "balance": 0.986279
      },
      "physical_valid": true,
      "physical_rejection_reasons": []
    },
    {
      "candidate_id": "cand_c2a11fa8e6ce",
      "candidate_fingerprint": "c2a11fa8e6ced72424f99850",
      "pick_item_id": "item_15",
      "pose": {
        "x_mm": -20.0,
        "y_mm": -305.0,
        "z_base_mm": 290.0,
        "yaw_deg": 0
      },
      "oriented_size_mm": [
        380,
        250,
        360
      ],
      "ems": {
        "ems_id": "ems_a52ae45917",
        "ems_type": "supported_space"
      },
      "support": {
        "support_item_ids": [
          "item_10"
        ],
        "support_ratio": 1.0,
        "com_margin_mm": 125.0
      },
      "load": {
        "downward_load_kg": 0.0,
        "minimum_remaining_capacity_kg": 52.19
      },
      "resulting_geometry": {
        "max_height_mm": 650.0,
        "volume_utilization": 0.402341,
        "center_of_mass_offset_mm": 14.155
      },
      "geometry_score_components": {
        "compactness": 0.575329,
        "height": 0.235294,
        "stability": 1.0,
        "balance": 0.981876
      },
      "physical_valid": true,
      "physical_rejection_reasons": []
    },
    {
      "candidate_id": "cand_489ed114977e",
      "candidate_fingerprint": "489ed114977e5b0bdd43bdf5",
      "pick_item_id": "item_15",
      "pose": {
        "x_mm": -30.0,
        "y_mm": -375.0,
        "z_base_mm": 290.0,
        "yaw_deg": 0
      },
      "oriented_size_mm": [
        380,
        250,
        360
      ],
      "ems": {
        "ems_id": "ems_6c921ac0f5",
        "ems_type": "supported_space"
      },
      "support": {
        "support_item_ids": [
          "item_10"
        ],
        "support_ratio": 0.72,
        "com_margin_mm": 55.0
      },
      "load": {
        "downward_load_kg": 0.0,
        "minimum_remaining_capacity_kg": 52.19
      },
      "resulting_geometry": {
        "max_height_mm": 650.0,
        "volume_utilization": 0.402341,
        "center_of_mass_offset_mm": 9.844
      },
      "geometry_score_components": {
        "compactness": 0.535056,
        "height": 0.235294,
        "stability": 0.72,
        "balance": 0.987396
      },
      "physical_valid": true,
      "physical_rejection_reasons": []
    },
    {
      "candidate_id": "cand_df7d3d9f1c54",
      "candidate_fingerprint": "df7d3d9f1c540ada11ff21f9",
      "pick_item_id": "item_15",
      "pose": {
        "x_mm": -30.0,
        "y_mm": -305.0,
        "z_base_mm": 290.0,
        "yaw_deg": 0
      },
      "oriented_size_mm": [
        380,
        250,
        360
      ],
      "ems": {
        "ems_id": "ems_f4d2c7a655",
        "ems_type": "supported_space"
      },
      "support": {
        "support_item_ids": [
          "item_10"
        ],
        "support_ratio": 1.0,
        "com_margin_mm": 125.0
      },
      "load": {
        "downward_load_kg": 0.0,
        "minimum_remaining_capacity_kg": 52.19
      },
      "resulting_geometry": {
        "max_height_mm": 650.0,
        "volume_utilization": 0.402341,
        "center_of_mass_offset_mm": 13.507
      },
      "geometry_score_components": {
        "compactness": 0.575329,
        "height": 0.235294,
        "stability": 1.0,
        "balance": 0.982706
      },
      "physical_valid": true,
      "physical_rejection_reasons": []
    },
    {
      "candidate_id": "cand_bbdad9e784ae",
      "candidate_fingerprint": "bbdad9e784ae87657a578d6b",
      "pick_item_id": "item_15",
      "pose": {
        "x_mm": -410.0,
        "y_mm": -375.0,
        "z_base_mm": 0.0,
        "yaw_deg": 0
      },
      "oriented_size_mm": [
        380,
        250,
        360
      ],
      "ems": {
        "ems_id": "ems_f9d9c78a5c",
        "ems_type": "floor_space"
      },
      "support": {
        "support_item_ids": [],
        "support_ratio": 1.0,
        "com_margin_mm": 125.0
      },
      "load": {
        "downward_load_kg": 0.0,
        "minimum_remaining_capacity_kg": null
      },
      "resulting_geometry": {
        "max_height_mm": 620.0,
        "volume_utilization": 0.402341,
        "center_of_mass_offset_mm": 26.081
      },
      "geometry_score_components": {
        "compactness": 0.560946,
        "height": 0.270588,
        "stability": 1.0,
        "balance": 0.966606
      },
      "physical_valid": true,
      "physical_rejection_reasons": []
    },
    {
      "candidate_id": "cand_fc4c8302fd16",
      "candidate_fingerprint": "fc4c8302fd16927af84eae52",
      "pick_item_id": "item_15",
      "pose": {
        "x_mm": -30.0,
        "y_mm": -295.0,
        "z_base_mm": 290.0,
        "yaw_deg": 0
      },
      "oriented_size_mm": [
        380,
        250,
        360
      ],
      "ems": {
        "ems_id": "ems_969623679a",
        "ems_type": "supported_space"
      },
      "support": {
        "support_item_ids": [
          "item_10"
        ],
        "support_ratio": 1.0,
        "com_margin_mm": 125.0
      },
      "load": {
        "downward_load_kg": 0.0,
        "minimum_remaining_capacity_kg": 52.19
      },
      "resulting_geometry": {
        "max_height_mm": 650.0,
        "volume_utilization": 0.402341,
        "center_of_mass_offset_mm": 14.194
      },
      "geometry_score_components": {
        "compactness": 0.575329,
        "height": 0.235294,
        "stability": 1.0,
        "balance": 0.981826
      },
      "physical_valid": true,
      "physical_rejection_reasons": []
    },
    {
      "candidate_id": "cand_42af5fb74a22",
      "candidate_fingerprint": "42af5fb74a22cb6f8cb3cec8",
      "pick_item_id": "item_15",
      "pose": {
        "x_mm": -410.0,
        "y_mm": 375.0,
        "z_base_mm": 240.0,
        "yaw_deg": 0
      },
      "oriented_size_mm": [
        380,
        250,
        360
      ],
      "ems": {
        "ems_id": "ems_cbce6f6cdb",
        "ems_type": "supported_space"
      },
      "support": {
        "support_item_ids": [
          "item_01"
        ],
        "support_ratio": 1.0,
        "com_margin_mm": 125.0
      },
      "load": {
        "downward_load_kg": 0.0,
        "minimum_remaining_capacity_kg": 7.45
      },
      "resulting_geometry": {
        "max_height_mm": 620.0,
        "volume_utilization": 0.402341,
        "center_of_mass_offset_mm": 77.134
      },
      "geometry_score_components": {
        "compactness": 0.603168,
        "height": 0.270588,
        "stability": 1.0,
        "balance": 0.90124
      },
      "physical_valid": true,
      "physical_rejection_reasons": []
    }
  ]
}
